{"anchors":{},"capabilities":["rig.biped@1"],"category":"Expressions","data":{"expression":{"browInner":0.2,"eyeOpen":1,"intensity":70,"mouthCurve":0.9,"mouthWidth":0.4,"restMouth":"B","transition":0.25}},"dependencies":[],"families":["flat","illustrated"],"group":"Social","id":"exp.fake-smile","kind":"exp","layering":{},"license":{"attribution":"Frame bundled content; free to use in exported videos, including commercially.","commercialUse":true,"id":"LicenseRef-Frame-Bundled","redistributable":true},"name":"Fake smile","parameters":[],"previews":{},"provenance":{"author":"Frame content pipeline (parametric authoring in tools/content)","date":"2026-10-22","method":"authored","notes":"Generated as part-contract data and validated by the rig check; awaiting human visual review (CAT-06)."},"review":{"status":"pending"},"schemaVersion":1,"synonyms":["social"],"tags":["expressions","social"],"version":1,"viewExemptions":{"back":"Faces are not visible from behind; expressions still drive head attitude."},"views":["front","three","side"]}
