{"anchors":{},"capabilities":["rig.biped@1"],"category":"Skin details and overlays","data":{"colors":{},"families":{"flat":{"exempt":{"back":"Worn on the face; hidden from behind."},"views":{"front":{"layers":[{"shapes":[{"ellipse":{"c":"a0","rx":0.049,"ry":0.042},"fill":"skin.line","opacity":0.9500000000000001},{"ellipse":{"c":"a1","rx":0.049,"ry":0.042},"fill":"skin.line","opacity":0.9500000000000001}],"slot":"face.overlay","space":"face"}],"points":{"a0":{"p":[-0.5,0.5]},"a1":{"p":[0.5,0.5]}}},"side":{"layers":[{"shapes":[{"ellipse":{"c":"a0","rx":0.049,"ry":0.042},"fill":"skin.line","opacity":0.9500000000000001}],"slot":"face.overlay","space":"face"}],"points":{"a0":{"p":[0.5,0.5]}}},"three":{"layers":[{"shapes":[{"ellipse":{"c":"a0","rx":0.049,"ry":0.042},"fill":"skin.line","opacity":0.9500000000000001},{"ellipse":{"c":"a1","rx":0.049,"ry":0.042},"fill":"skin.line","opacity":0.9500000000000001}],"slot":"face.overlay","space":"face"}],"points":{"a0":{"p":[-0.0585,0.5]},"a1":{"p":[0.7265,0.5]}}}}},"illustrated":{"exempt":{"back":"Worn on the face; hidden from behind."},"views":{"front":{"layers":[{"shapes":[{"ellipse":{"c":"a0","rx":0.049,"ry":0.042},"fill":"skin.line","opacity":0.9500000000000001},{"ellipse":{"c":"a1","rx":0.049,"ry":0.042},"fill":"skin.line","opacity":0.9500000000000001}],"slot":"face.overlay","space":"face"}],"points":{"a0":{"p":[-0.5,0.5]},"a1":{"p":[0.5,0.5]}}},"side":{"layers":[{"shapes":[{"ellipse":{"c":"a0","rx":0.049,"ry":0.042},"fill":"skin.line","opacity":0.9500000000000001}],"slot":"face.overlay","space":"face"}],"points":{"a0":{"p":[0.5,0.5]}}},"three":{"layers":[{"shapes":[{"ellipse":{"c":"a0","rx":0.049,"ry":0.042},"fill":"skin.line","opacity":0.9500000000000001},{"ellipse":{"c":"a1","rx":0.049,"ry":0.042},"fill":"skin.line","opacity":0.9500000000000001}],"slot":"face.overlay","space":"face"}],"points":{"a0":{"p":[-0.0585,0.5]},"a1":{"p":[0.7265,0.5]}}}}}},"slot":"skin-detail"},"dependencies":[],"families":["flat","illustrated"],"group":"Skin details and overlays","id":"skin-detail.moles","kind":"skin-detail","layering":{},"license":{"attribution":"Frame bundled content; free to use in exported videos, including commercially.","commercialUse":true,"id":"LicenseRef-Frame-Bundled","redistributable":true},"name":"Moles","parameters":[],"previews":{},"provenance":{"author":"Frame content pipeline (parametric authoring in tools/content)","date":"2026-10-22","method":"authored","notes":"Generated as part-contract data and validated by the rig check; awaiting human visual review (CAT-06)."},"review":{"status":"pending"},"schemaVersion":1,"synonyms":[],"tags":["skin details and overlays"],"version":1,"viewExemptions":{"back":"Worn on the face; hidden from behind."},"views":["front","three","side"]}
