{"anchors":{"bounds":[-14,-70,28,70],"grip":[0,-55]},"capabilities":["pinch","unlock"],"category":"Props","data":{"colors":{"metal":"#D9B25F"},"families":{"flat":{"exempt":{"back":"Props are drawn from the camera.","side":"Props are drawn from the camera.","three":"Props are drawn from the camera; they do not turn with character views."},"views":{"front":{"layers":[{"shapes":[{"ellipse":{"c":"o0","rx":14,"ry":14},"fill":"metal"},{"ellipse":{"c":"o1","rx":6,"ry":6},"fill":"metal.shade"},{"fill":"metal","path":[["M","o2"],["L","o3"],["L","o4"],["L","o5"],["Z"]]},{"fill":"metal","path":[["M","o6"],["L","o7"],["L","o8"],["L","o9"],["Z"]]},{"fill":"metal","path":[["M","o10"],["L","o11"],["L","o12"],["L","o13"],["Z"]]}],"slot":"prop","space":"stage"}],"points":{"o0":{"p":[0,-55]},"o1":{"p":[0,-55]},"o10":{"p":[3,-6]},"o11":{"p":[9,-6]},"o12":{"p":[9,-1]},"o13":{"p":[3,-1]},"o2":{"p":[-3,-42]},"o3":{"p":[3,-42]},"o4":{"p":[3,0]},"o5":{"p":[-3,0]},"o6":{"p":[3,-14]},"o7":{"p":[11,-14]},"o8":{"p":[11,-9]},"o9":{"p":[3,-9]}}}}},"illustrated":{"exempt":{"back":"Props are drawn from the camera.","side":"Props are drawn from the camera.","three":"Props are drawn from the camera; they do not turn with character views."},"views":{"front":{"layers":[{"shapes":[{"ellipse":{"c":"o0","rx":14,"ry":14},"fill":{"lin":{"from":"o1","stops":[[0,"metal.light"],[0.55,"metal"],[1,"metal.shade"]],"to":"o2"}},"stroke":{"c":"metal.line","w":1.4}},{"ellipse":{"c":"o3","rx":6,"ry":6},"fill":"metal.shade"},{"fill":"metal","path":[["M","o4"],["L","o5"],["L","o6"],["L","o7"],["Z"]]},{"fill":"metal","path":[["M","o8"],["L","o9"],["L","o10"],["L","o11"],["Z"]]},{"fill":"metal","path":[["M","o12"],["L","o13"],["L","o14"],["L","o15"],["Z"]]}],"slot":"prop","space":"stage"}],"points":{"o0":{"p":[0,-55]},"o1":{"p":[0,-69]},"o10":{"p":[11,-9]},"o11":{"p":[3,-9]},"o12":{"p":[3,-6]},"o13":{"p":[9,-6]},"o14":{"p":[9,-1]},"o15":{"p":[3,-1]},"o2":{"p":[0,-41]},"o3":{"p":[0,-55]},"o4":{"p":[-3,-42]},"o5":{"p":[3,-42]},"o6":{"p":[3,0]},"o7":{"p":[-3,0]},"o8":{"p":[3,-14]},"o9":{"p":[11,-14]}}}}}},"slot":"prop"},"dependencies":[],"families":["flat","illustrated"],"group":"Props","id":"prop.key","kind":"prop","layering":{},"license":{"attribution":"Frame bundled content; free to use in exported videos, including commercially.","commercialUse":true,"id":"LicenseRef-Frame-Bundled","redistributable":true},"name":"Key","parameters":[],"previews":{},"provenance":{"author":"Frame content pipeline (parametric authoring in tools/content)","date":"2026-10-22","method":"authored","notes":"Generated as part-contract data and validated by the rig check; awaiting human visual review (CAT-06)."},"review":{"status":"pending"},"schemaVersion":1,"synonyms":["mystery","interactive","pinch"],"tags":["props"],"version":1,"viewExemptions":{"back":"Props are drawn from the camera.","side":"Props are drawn from the camera.","three":"Props are drawn from the camera."},"views":["front"]}
