{"anchors":{},"capabilities":[],"category":"Motion and visual effects","data":{"effect":{"symbol":"zzz","type":"symbol"}},"dependencies":[],"families":[],"group":"Emotional symbol","id":"fx.zzz","kind":"fx","layering":{},"license":{"attribution":"Frame bundled content; free to use in exported videos, including commercially.","commercialUse":true,"id":"LicenseRef-Frame-Bundled","redistributable":true},"name":"Zzz","parameters":[{"default":1,"key":"intensity","label":"Intensity","range":[0,2],"type":"number"}],"previews":{},"provenance":{"author":"Frame content pipeline (parametric authoring in tools/content)","date":"2026-10-22","method":"authored","notes":"Generated as part-contract data and validated by the rig check; awaiting human visual review (CAT-06)."},"review":{"status":"pending"},"schemaVersion":1,"synonyms":["emotional","symbol"],"tags":["motion and visual effects","emotional symbol","effect"],"version":1,"viewExemptions":{},"views":[]}
