{"anchors":{},"capabilities":[],"category":"Text, graphics and finishing","data":{"bubble":{"shape":"thought"}},"dependencies":[],"families":[],"group":"Bubble","id":"txt.thought-bubble","kind":"txt","layering":{},"license":{"attribution":"Frame bundled content; free to use in exported videos, including commercially.","commercialUse":true,"id":"LicenseRef-Frame-Bundled","redistributable":true},"name":"Thought bubble","parameters":[{"default":"","key":"text","label":"Text","type":"string"}],"previews":{},"provenance":{"author":"Frame content pipeline (parametric authoring in tools/content)","date":"2026-10-22","method":"authored","notes":"Generated as part-contract data and validated by the rig check; awaiting human visual review (CAT-06)."},"review":{"status":"pending"},"schemaVersion":1,"synonyms":[],"tags":["text, graphics and finishing","bubble"],"version":1,"viewExemptions":{},"views":[]}
