{"anchors":{},"capabilities":[],"category":"Ready-made sets","data":{"set":{"cameras":[{"name":"Wide","width":1920,"x":960,"y":620},{"name":"Two-shot","width":1160,"x":730,"y":640}],"kit":"kit.fantasy-forest@1","marks":[{"facing":"front","name":"Steps","x":960,"y":1000},{"facing":"right","name":"Pillar","x":500,"y":1000}],"palette":"muted","parts":["sky","trees","floor"],"props":[],"timeOfDay":"dusk"}},"dependencies":["kit.fantasy-forest@1"],"families":["flat","illustrated"],"group":"Ready-made sets","id":"set.ruined-temple","kind":"set","layering":{},"license":{"attribution":"Frame bundled content; free to use in exported videos, including commercially.","commercialUse":true,"id":"LicenseRef-Frame-Bundled","redistributable":true},"name":"Ruined temple","parameters":[],"previews":{},"provenance":{"author":"Frame content pipeline (parametric authoring in tools/content)","date":"2026-10-22","method":"authored","notes":"Generated as part-contract data and validated by the rig check; awaiting human visual review (CAT-06)."},"review":{"status":"pending"},"schemaVersion":1,"synonyms":["fantasy","forest"],"tags":["ready-made sets"],"version":1,"viewExemptions":{},"views":["front"]}
