{"anchors":{},"capabilities":[],"category":"Camera language","data":{"recipe":{"duration":6,"roles":[{"key":"a","kind":"character","label":"First"},{"key":"b","kind":"character","label":"Second"}],"steps":[{"at":0,"dur":1.5,"shot":{"framing":"cam.close-up@1","subjects":["a"]},"track":"shot"},{"at":1.5,"dur":1.5,"shot":{"framing":"cam.close-up@1","subjects":["b"]},"track":"shot"},{"at":3,"dur":1.5,"shot":{"framing":"cam.close-up@1","subjects":["a"]},"track":"shot"},{"at":4.5,"dur":1.5,"shot":{"framing":"cam.close-up@1","subjects":["b"]},"track":"shot"}]}},"dependencies":[],"families":[],"group":"Shot recipe","id":"cam.reaction-ping-pong","kind":"cam","layering":{},"license":{"attribution":"Frame bundled content; free to use in exported videos, including commercially.","commercialUse":true,"id":"LicenseRef-Frame-Bundled","redistributable":true},"name":"Reaction ping-pong","parameters":[],"previews":{},"provenance":{"author":"Frame content pipeline (parametric authoring in tools/content)","date":"2026-10-22","method":"authored","notes":"Generated as part-contract data and validated by the rig check; awaiting human visual review (CAT-06)."},"review":{"status":"pending"},"schemaVersion":1,"synonyms":["shot","recipe"],"tags":["camera language","shot recipe","camera"],"version":1,"viewExemptions":{},"views":[]}
