{"anchors":{},"capabilities":[],"category":"Musical cues and stings","data":{"sound":{"loop":false,"media":{"bytes":230444,"channels":1,"durationS":2.4,"ext":"wav","hash":"sha256-cbe15b9461cdc0be4fe73da41453c246ed01cac9dc526f84080877f5a25e86e4","mime":"audio/wav","sampleRate":48000},"peakDbfs":-3}},"dependencies":[],"families":[],"group":"Musical cues and stings","id":"cue.magic-chime","kind":"cue","layering":{},"license":{"attribution":"Frame bundled content; free to use in exported videos, including commercially.","commercialUse":true,"id":"LicenseRef-Frame-Bundled","redistributable":true},"name":"Magic chime","parameters":[],"previews":{},"provenance":{"author":"Frame content pipeline (procedural synthesis in tools/content/music.ts)","date":"2026-10-22","method":"authored","notes":"Synthesised (additive, FM and plucked-string voices; filtered noise); no recordings or third-party samples. Placeholder awaiting listening review (CAT-06/CAT-08)."},"review":{"status":"pending"},"schemaVersion":1,"synonyms":["sparkle","idea"],"tags":["musical cues and stings","sound","cue"],"version":1,"viewExemptions":{},"views":[]}
