{"anchors":{},"capabilities":[],"category":"Brow states","data":{"browState":{"furrow":0.8,"inner":-0.8}},"dependencies":[],"families":[],"group":"Brow states","id":"browstate.inner-lowered","kind":"browstate","layering":{},"license":{"attribution":"Frame bundled content; free to use in exported videos, including commercially.","commercialUse":true,"id":"LicenseRef-Frame-Bundled","redistributable":true},"name":"Inner lowered","parameters":[],"previews":{},"provenance":{"author":"Frame content pipeline (parametric authoring in tools/content)","date":"2026-10-22","method":"authored","notes":"Generated as part-contract data and validated by the rig check; awaiting human visual review (CAT-06)."},"review":{"status":"pending"},"schemaVersion":1,"synonyms":["anger"],"tags":["brow states"],"version":1,"viewExemptions":{},"views":[]}
