{"anchors":{},"capabilities":["rig.biped@1"],"category":"Skin details and overlays","data":{"colors":{},"families":{"flat":{"exempt":{"back":"Worn on the face; hidden from behind."},"views":{"front":{"layers":[{"shapes":[{"opacity":0.6,"path":[["M","a0"],["C","a1","a2","a3"],["C","a4","a5","a6"]],"stroke":{"c":"skin.shade","w":1.2}},{"opacity":0.6,"path":[["M","a7"],["C","a8","a9","a10"],["C","a11","a12","a13"]],"stroke":{"c":"skin.shade","w":1.2}}],"slot":"face.overlay","space":"face"}],"points":{"a0":{"p":[-0.54,0.24]},"a1":{"p":[-0.5213,0.2453]},"a10":{"p":[0.4,0.28]},"a11":{"p":[0.4373,0.28]},"a12":{"p":[0.5587,0.2347]},"a13":{"p":[0.54,0.24]},"a2":{"p":[-0.3627,0.28]},"a3":{"p":[-0.4,0.28]},"a4":{"p":[-0.3627,0.28]},"a5":{"p":[-0.2413,0.2347]},"a6":{"p":[-0.26,0.24]},"a7":{"p":[0.26,0.24]},"a8":{"p":[0.2787,0.2453]},"a9":{"p":[0.4373,0.28]}}},"side":{"layers":[{"shapes":[{"opacity":0.6,"path":[["M","a0"],["C","a1","a2","a3"],["C","a4","a5","a6"]],"stroke":{"c":"skin.shade","w":1.2}}],"slot":"face.overlay","space":"face"}],"points":{"a0":{"p":[0.48,0.24]},"a1":{"p":[0.4987,0.2453]},"a2":{"p":[0.6573,0.28]},"a3":{"p":[0.62,0.28]},"a4":{"p":[0.6573,0.28]},"a5":{"p":[0.7787,0.2347]},"a6":{"p":[0.76,0.24]}}},"three":{"layers":[{"shapes":[{"opacity":0.6,"path":[["M","a0"],["C","a1","a2","a3"],["C","a4","a5","a6"]],"stroke":{"c":"skin.shade","w":1.2}},{"opacity":0.6,"path":[["M","a7"],["C","a8","a9","a10"],["C","a11","a12","a13"]],"stroke":{"c":"skin.shade","w":1.2}}],"slot":"face.overlay","space":"face"}],"points":{"a0":{"p":[-0.12,0.24]},"a1":{"p":[-0.1013,0.2453]},"a10":{"p":[0.648,0.28]},"a11":{"p":[0.6853,0.28]},"a12":{"p":[0.8067,0.2347]},"a13":{"p":[0.788,0.24]},"a2":{"p":[0.0573,0.28]},"a3":{"p":[0.02,0.28]},"a4":{"p":[0.0573,0.28]},"a5":{"p":[0.1787,0.2347]},"a6":{"p":[0.16,0.24]},"a7":{"p":[0.508,0.24]},"a8":{"p":[0.5267,0.2453]},"a9":{"p":[0.6853,0.28]}}}}},"illustrated":{"exempt":{"back":"Worn on the face; hidden from behind."},"views":{"front":{"layers":[{"shapes":[{"opacity":0.6,"path":[["M","a0"],["C","a1","a2","a3"],["C","a4","a5","a6"]],"stroke":{"c":"skin.shade","w":1.2}},{"opacity":0.6,"path":[["M","a7"],["C","a8","a9","a10"],["C","a11","a12","a13"]],"stroke":{"c":"skin.shade","w":1.2}}],"slot":"face.overlay","space":"face"}],"points":{"a0":{"p":[-0.54,0.24]},"a1":{"p":[-0.5213,0.2453]},"a10":{"p":[0.4,0.28]},"a11":{"p":[0.4373,0.28]},"a12":{"p":[0.5587,0.2347]},"a13":{"p":[0.54,0.24]},"a2":{"p":[-0.3627,0.28]},"a3":{"p":[-0.4,0.28]},"a4":{"p":[-0.3627,0.28]},"a5":{"p":[-0.2413,0.2347]},"a6":{"p":[-0.26,0.24]},"a7":{"p":[0.26,0.24]},"a8":{"p":[0.2787,0.2453]},"a9":{"p":[0.4373,0.28]}}},"side":{"layers":[{"shapes":[{"opacity":0.6,"path":[["M","a0"],["C","a1","a2","a3"],["C","a4","a5","a6"]],"stroke":{"c":"skin.shade","w":1.2}}],"slot":"face.overlay","space":"face"}],"points":{"a0":{"p":[0.48,0.24]},"a1":{"p":[0.4987,0.2453]},"a2":{"p":[0.6573,0.28]},"a3":{"p":[0.62,0.28]},"a4":{"p":[0.6573,0.28]},"a5":{"p":[0.7787,0.2347]},"a6":{"p":[0.76,0.24]}}},"three":{"layers":[{"shapes":[{"opacity":0.6,"path":[["M","a0"],["C","a1","a2","a3"],["C","a4","a5","a6"]],"stroke":{"c":"skin.shade","w":1.2}},{"opacity":0.6,"path":[["M","a7"],["C","a8","a9","a10"],["C","a11","a12","a13"]],"stroke":{"c":"skin.shade","w":1.2}}],"slot":"face.overlay","space":"face"}],"points":{"a0":{"p":[-0.12,0.24]},"a1":{"p":[-0.1013,0.2453]},"a10":{"p":[0.648,0.28]},"a11":{"p":[0.6853,0.28]},"a12":{"p":[0.8067,0.2347]},"a13":{"p":[0.788,0.24]},"a2":{"p":[0.0573,0.28]},"a3":{"p":[0.02,0.28]},"a4":{"p":[0.0573,0.28]},"a5":{"p":[0.1787,0.2347]},"a6":{"p":[0.16,0.24]},"a7":{"p":[0.508,0.24]},"a8":{"p":[0.5267,0.2453]},"a9":{"p":[0.6853,0.28]}}}}}},"slot":"skin-detail"},"dependencies":[],"families":["flat","illustrated"],"group":"Skin details and overlays","id":"skin-detail.under-eye-bags","kind":"skin-detail","layering":{},"license":{"attribution":"Frame bundled content; free to use in exported videos, including commercially.","commercialUse":true,"id":"LicenseRef-Frame-Bundled","redistributable":true},"name":"Under-eye bags","parameters":[],"previews":{},"provenance":{"author":"Frame content pipeline (parametric authoring in tools/content)","date":"2026-10-22","method":"authored","notes":"Generated as part-contract data and validated by the rig check; awaiting human visual review (CAT-06)."},"review":{"status":"pending"},"schemaVersion":1,"synonyms":[],"tags":["skin details and overlays"],"version":1,"viewExemptions":{"back":"Worn on the face; hidden from behind."},"views":["front","three","side"]}
