{"anchors":{},"capabilities":[],"category":"Environment layers","data":{"layer":{"parallax":0.75,"plane":"back"}},"dependencies":[],"families":[],"group":"Environment layers","id":"layer.main-setting","kind":"layer","layering":{},"license":{"attribution":"Frame bundled content; free to use in exported videos, including commercially.","commercialUse":true,"id":"LicenseRef-Frame-Bundled","redistributable":true},"name":"Main setting","parameters":[],"previews":{},"provenance":{"author":"Frame content pipeline (parametric authoring in tools/content)","date":"2026-10-22","method":"authored","notes":"Generated as part-contract data and validated by the rig check; awaiting human visual review (CAT-06)."},"review":{"status":"pending"},"schemaVersion":1,"synonyms":["back"],"tags":["environment layers"],"version":1,"viewExemptions":{},"views":[]}
