{"anchors":{},"capabilities":[],"category":"Camera language","data":{"recipe":{"duration":4,"roles":[],"steps":[{"at":0,"dur":4,"shot":{"framing":"cam.extreme-wide@1","subjects":[]},"track":"shot"},{"asset":"cam.pan@1","at":0,"dur":4,"track":"camera-move"}]}},"dependencies":[],"families":[],"group":"Shot recipe","id":"cam.establishing-pan","kind":"cam","layering":{},"license":{"attribution":"Frame bundled content; free to use in exported videos, including commercially.","commercialUse":true,"id":"LicenseRef-Frame-Bundled","redistributable":true},"name":"Establishing pan","parameters":[],"previews":{},"provenance":{"author":"Frame content pipeline (parametric authoring in tools/content)","date":"2026-10-22","method":"authored","notes":"Generated as part-contract data and validated by the rig check; awaiting human visual review (CAT-06)."},"review":{"status":"pending"},"schemaVersion":1,"synonyms":["shot","recipe"],"tags":["camera language","shot recipe","camera"],"version":1,"viewExemptions":{},"views":[]}
