{"anchors":{},"capabilities":[],"category":"Output presets","data":{"output":{"container":"png","stems":false,"video":"png"}},"dependencies":[],"families":[],"group":"Output presets","id":"out.image-sequence","kind":"out","layering":{},"license":{"attribution":"Frame bundled content; free to use in exported videos, including commercially.","commercialUse":true,"id":"LicenseRef-Frame-Bundled","redistributable":true},"name":"Image sequence","parameters":[],"previews":{},"provenance":{"author":"Frame content pipeline (parametric authoring in tools/content)","date":"2026-10-22","method":"authored","notes":"Generated as part-contract data and validated by the rig check; awaiting human visual review (CAT-06)."},"review":{"status":"pending"},"schemaVersion":1,"synonyms":["png","frames","wav"],"tags":["output presets","export"],"version":1,"viewExemptions":{},"views":[]}
