{"anchors":{},"capabilities":["rig.biped@1","channel:head"],"category":"Performance clips","data":{"action":{"additive":true,"channels":["head"],"duration":1.2,"keys":{"head.yaw":[{"t":0,"v":0},{"t":0.2,"v":-14},{"t":0.45,"v":14},{"t":0.7,"v":-12},{"t":1,"v":0}]},"loop":false,"postures":["standing","seated"]}},"dependencies":[],"families":["flat","illustrated"],"group":"Listening","id":"act.head-shake","kind":"act","layering":{},"license":{"attribution":"Frame bundled content; free to use in exported videos, including commercially.","commercialUse":true,"id":"LicenseRef-Frame-Bundled","redistributable":true},"name":"Head shake","parameters":[{"default":1,"key":"intensity","label":"Intensity","range":[0,2],"type":"number"},{"default":1,"key":"speed","label":"Speed","range":[0.25,3],"type":"number"}],"previews":{},"provenance":{"author":"Frame content pipeline (parametric authoring in tools/content)","date":"2026-10-22","method":"authored","notes":"Generated as part-contract data and validated by the rig check; awaiting human visual review (CAT-06)."},"review":{"status":"pending"},"schemaVersion":1,"synonyms":["listening"],"tags":["performance clips","listening"],"version":1,"viewExemptions":{},"views":["front","three","side","back"]}
