{"anchors":{},"capabilities":[],"category":"Sound effects","data":{"sound":{"loop":false,"media":{"bytes":33644,"channels":1,"durationS":0.35,"ext":"wav","hash":"sha256-c55e3be11582a841252266ea737576a55ac687dd8f26665f2ec53b30ba83cb23","mime":"audio/wav","sampleRate":48000},"peakDbfs":-3}},"dependencies":[],"families":[],"group":"Motion","id":"sfx.swish","kind":"sfx","layering":{},"license":{"attribution":"Frame bundled content; free to use in exported videos, including commercially.","commercialUse":true,"id":"LicenseRef-Frame-Bundled","redistributable":true},"name":"Swish","parameters":[],"previews":{},"provenance":{"author":"Frame content pipeline (procedural synthesis in tools/content/sounds.ts)","date":"2026-10-22","method":"authored","notes":"Synthesised from noise, resonators and envelopes; no recordings or third-party samples. Placeholder foley awaiting listening review (CAT-06/CAT-08)."},"review":{"status":"pending"},"schemaVersion":1,"synonyms":["motion"],"tags":["sound effects","motion","sound"],"version":1,"viewExemptions":{},"views":[]}
