{"anchors":{},"capabilities":["rig.biped@1"],"category":"Accessories","data":{"colorSlot":"acc","colors":{"acc":"#7A5236"},"families":{"flat":{"exempt":{"back":"Worn on the front of the body; hidden from behind."},"views":{"front":{"layers":[{"shapes":[{"path":[["M","a0"],["L","a1"]],"stroke":{"c":"acc.deep","w":3.4}},{"fill":"acc","path":[["M","a2"],["C","a3","a4","a5"],["C","a6","a7","a8"],["C","a9","a10","a11"],["C","a12","a13","a14"],["Z"]]},{"fill":"acc.shade","path":[["M","a15"],["C","a16","a17","a18"],["C","a19","a20","a21"],["C","a22","a23","a24"],["C","a25","a26","a27"],["Z"]]}],"slot":"acc.waist","space":"torso"}],"points":{"a0":{"p":[-0.55,-0.16]},"a1":{"p":[0.7,0.95]},"a10":{"p":[0.4267,1.285]},"a11":{"p":[0.45,1.3]},"a12":{"p":[0.4267,1.285]},"a13":{"p":[0.4733,0.835]},"a14":{"p":[0.45,0.85]},"a15":{"p":[0.45,0.85]},"a16":{"p":[0.4733,0.8433]},"a17":{"p":[1.1733,0.8567]},"a18":{"p":[1.15,0.85]},"a19":{"p":[1.1733,0.8567]},"a2":{"p":[0.45,0.85]},"a20":{"p":[1.1267,1.0567]},"a21":{"p":[1.15,1.05]},"a22":{"p":[1.1267,1.0567]},"a23":{"p":[0.4267,1.0433]},"a24":{"p":[0.45,1.05]},"a25":{"p":[0.4267,1.0433]},"a26":{"p":[0.4733,0.8433]},"a27":{"p":[0.45,0.85]},"a3":{"p":[0.4733,0.835]},"a4":{"p":[1.1733,0.865]},"a5":{"p":[1.15,0.85]},"a6":{"p":[1.1733,0.865]},"a7":{"p":[1.1267,1.315]},"a8":{"p":[1.15,1.3]},"a9":{"p":[1.1267,1.315]}}},"side":{"layers":[{"shapes":[{"path":[["M","a0"],["L","a1"]],"stroke":{"c":"acc.deep","w":3.4}},{"fill":"acc","path":[["M","a2"],["C","a3","a4","a5"],["C","a6","a7","a8"],["C","a9","a10","a11"],["C","a12","a13","a14"],["Z"]]},{"fill":"acc.shade","path":[["M","a15"],["C","a16","a17","a18"],["C","a19","a20","a21"],["C","a22","a23","a24"],["C","a25","a26","a27"],["Z"]]}],"slot":"acc.waist","space":"torso"}],"points":{"a0":{"p":[-0.55,-0.16]},"a1":{"p":[0.7,0.95]},"a10":{"p":[0.4267,1.285]},"a11":{"p":[0.45,1.3]},"a12":{"p":[0.4267,1.285]},"a13":{"p":[0.4733,0.835]},"a14":{"p":[0.45,0.85]},"a15":{"p":[0.45,0.85]},"a16":{"p":[0.4733,0.8433]},"a17":{"p":[1.1733,0.8567]},"a18":{"p":[1.15,0.85]},"a19":{"p":[1.1733,0.8567]},"a2":{"p":[0.45,0.85]},"a20":{"p":[1.1267,1.0567]},"a21":{"p":[1.15,1.05]},"a22":{"p":[1.1267,1.0567]},"a23":{"p":[0.4267,1.0433]},"a24":{"p":[0.45,1.05]},"a25":{"p":[0.4267,1.0433]},"a26":{"p":[0.4733,0.8433]},"a27":{"p":[0.45,0.85]},"a3":{"p":[0.4733,0.835]},"a4":{"p":[1.1733,0.865]},"a5":{"p":[1.15,0.85]},"a6":{"p":[1.1733,0.865]},"a7":{"p":[1.1267,1.315]},"a8":{"p":[1.15,1.3]},"a9":{"p":[1.1267,1.315]}}},"three":{"layers":[{"shapes":[{"path":[["M","a0"],["L","a1"]],"stroke":{"c":"acc.deep","w":3.4}},{"fill":"acc","path":[["M","a2"],["C","a3","a4","a5"],["C","a6","a7","a8"],["C","a9","a10","a11"],["C","a12","a13","a14"],["Z"]]},{"fill":"acc.shade","path":[["M","a15"],["C","a16","a17","a18"],["C","a19","a20","a21"],["C","a22","a23","a24"],["C","a25","a26","a27"],["Z"]]}],"slot":"acc.waist","space":"torso"}],"points":{"a0":{"p":[-0.55,-0.16]},"a1":{"p":[0.7,0.95]},"a10":{"p":[0.4267,1.285]},"a11":{"p":[0.45,1.3]},"a12":{"p":[0.4267,1.285]},"a13":{"p":[0.4733,0.835]},"a14":{"p":[0.45,0.85]},"a15":{"p":[0.45,0.85]},"a16":{"p":[0.4733,0.8433]},"a17":{"p":[1.1733,0.8567]},"a18":{"p":[1.15,0.85]},"a19":{"p":[1.1733,0.8567]},"a2":{"p":[0.45,0.85]},"a20":{"p":[1.1267,1.0567]},"a21":{"p":[1.15,1.05]},"a22":{"p":[1.1267,1.0567]},"a23":{"p":[0.4267,1.0433]},"a24":{"p":[0.45,1.05]},"a25":{"p":[0.4267,1.0433]},"a26":{"p":[0.4733,0.8433]},"a27":{"p":[0.45,0.85]},"a3":{"p":[0.4733,0.835]},"a4":{"p":[1.1733,0.865]},"a5":{"p":[1.15,0.85]},"a6":{"p":[1.1733,0.865]},"a7":{"p":[1.1267,1.315]},"a8":{"p":[1.15,1.3]},"a9":{"p":[1.1267,1.315]}}}}},"illustrated":{"exempt":{"back":"Worn on the front of the body; hidden from behind."},"views":{"front":{"layers":[{"shapes":[{"path":[["M","a0"],["L","a1"]],"stroke":{"c":"acc.deep","w":3.4}},{"fill":"acc","path":[["M","a2"],["C","a3","a4","a5"],["C","a6","a7","a8"],["C","a9","a10","a11"],["C","a12","a13","a14"],["Z"]],"stroke":{"c":"acc.line","w":1.1}},{"fill":"acc.shade","path":[["M","a15"],["C","a16","a17","a18"],["C","a19","a20","a21"],["C","a22","a23","a24"],["C","a25","a26","a27"],["Z"]]}],"slot":"acc.waist","space":"torso"}],"points":{"a0":{"p":[-0.55,-0.16]},"a1":{"p":[0.7,0.95]},"a10":{"p":[0.4267,1.285]},"a11":{"p":[0.45,1.3]},"a12":{"p":[0.4267,1.285]},"a13":{"p":[0.4733,0.835]},"a14":{"p":[0.45,0.85]},"a15":{"p":[0.45,0.85]},"a16":{"p":[0.4733,0.8433]},"a17":{"p":[1.1733,0.8567]},"a18":{"p":[1.15,0.85]},"a19":{"p":[1.1733,0.8567]},"a2":{"p":[0.45,0.85]},"a20":{"p":[1.1267,1.0567]},"a21":{"p":[1.15,1.05]},"a22":{"p":[1.1267,1.0567]},"a23":{"p":[0.4267,1.0433]},"a24":{"p":[0.45,1.05]},"a25":{"p":[0.4267,1.0433]},"a26":{"p":[0.4733,0.8433]},"a27":{"p":[0.45,0.85]},"a3":{"p":[0.4733,0.835]},"a4":{"p":[1.1733,0.865]},"a5":{"p":[1.15,0.85]},"a6":{"p":[1.1733,0.865]},"a7":{"p":[1.1267,1.315]},"a8":{"p":[1.15,1.3]},"a9":{"p":[1.1267,1.315]}}},"side":{"layers":[{"shapes":[{"path":[["M","a0"],["L","a1"]],"stroke":{"c":"acc.deep","w":3.4}},{"fill":"acc","path":[["M","a2"],["C","a3","a4","a5"],["C","a6","a7","a8"],["C","a9","a10","a11"],["C","a12","a13","a14"],["Z"]],"stroke":{"c":"acc.line","w":1.1}},{"fill":"acc.shade","path":[["M","a15"],["C","a16","a17","a18"],["C","a19","a20","a21"],["C","a22","a23","a24"],["C","a25","a26","a27"],["Z"]]}],"slot":"acc.waist","space":"torso"}],"points":{"a0":{"p":[-0.55,-0.16]},"a1":{"p":[0.7,0.95]},"a10":{"p":[0.4267,1.285]},"a11":{"p":[0.45,1.3]},"a12":{"p":[0.4267,1.285]},"a13":{"p":[0.4733,0.835]},"a14":{"p":[0.45,0.85]},"a15":{"p":[0.45,0.85]},"a16":{"p":[0.4733,0.8433]},"a17":{"p":[1.1733,0.8567]},"a18":{"p":[1.15,0.85]},"a19":{"p":[1.1733,0.8567]},"a2":{"p":[0.45,0.85]},"a20":{"p":[1.1267,1.0567]},"a21":{"p":[1.15,1.05]},"a22":{"p":[1.1267,1.0567]},"a23":{"p":[0.4267,1.0433]},"a24":{"p":[0.45,1.05]},"a25":{"p":[0.4267,1.0433]},"a26":{"p":[0.4733,0.8433]},"a27":{"p":[0.45,0.85]},"a3":{"p":[0.4733,0.835]},"a4":{"p":[1.1733,0.865]},"a5":{"p":[1.15,0.85]},"a6":{"p":[1.1733,0.865]},"a7":{"p":[1.1267,1.315]},"a8":{"p":[1.15,1.3]},"a9":{"p":[1.1267,1.315]}}},"three":{"layers":[{"shapes":[{"path":[["M","a0"],["L","a1"]],"stroke":{"c":"acc.deep","w":3.4}},{"fill":"acc","path":[["M","a2"],["C","a3","a4","a5"],["C","a6","a7","a8"],["C","a9","a10","a11"],["C","a12","a13","a14"],["Z"]],"stroke":{"c":"acc.line","w":1.1}},{"fill":"acc.shade","path":[["M","a15"],["C","a16","a17","a18"],["C","a19","a20","a21"],["C","a22","a23","a24"],["C","a25","a26","a27"],["Z"]]}],"slot":"acc.waist","space":"torso"}],"points":{"a0":{"p":[-0.55,-0.16]},"a1":{"p":[0.7,0.95]},"a10":{"p":[0.4267,1.285]},"a11":{"p":[0.45,1.3]},"a12":{"p":[0.4267,1.285]},"a13":{"p":[0.4733,0.835]},"a14":{"p":[0.45,0.85]},"a15":{"p":[0.45,0.85]},"a16":{"p":[0.4733,0.8433]},"a17":{"p":[1.1733,0.8567]},"a18":{"p":[1.15,0.85]},"a19":{"p":[1.1733,0.8567]},"a2":{"p":[0.45,0.85]},"a20":{"p":[1.1267,1.0567]},"a21":{"p":[1.15,1.05]},"a22":{"p":[1.1267,1.0567]},"a23":{"p":[0.4267,1.0433]},"a24":{"p":[0.45,1.05]},"a25":{"p":[0.4267,1.0433]},"a26":{"p":[0.4733,0.8433]},"a27":{"p":[0.45,0.85]},"a3":{"p":[0.4733,0.835]},"a4":{"p":[1.1733,0.865]},"a5":{"p":[1.15,0.85]},"a6":{"p":[1.1733,0.865]},"a7":{"p":[1.1267,1.315]},"a8":{"p":[1.15,1.3]},"a9":{"p":[1.1267,1.315]}}}}}},"slot":"acc"},"dependencies":[],"families":["flat","illustrated"],"group":"Accessories","id":"acc.messenger-bag","kind":"acc","layering":{},"license":{"attribution":"Frame bundled content; free to use in exported videos, including commercially.","commercialUse":true,"id":"LicenseRef-Frame-Bundled","redistributable":true},"name":"Messenger bag","parameters":[],"previews":{},"provenance":{"author":"Frame content pipeline (parametric authoring in tools/content)","date":"2026-10-22","method":"authored","notes":"Generated as part-contract data and validated by the rig check; awaiting human visual review (CAT-06)."},"review":{"status":"pending"},"schemaVersion":1,"synonyms":["shoulder"],"tags":["accessories"],"version":1,"viewExemptions":{"back":"Worn on the front of the body; hidden from behind."},"views":["front","three","side"]}
