{"anchors":{},"capabilities":[],"category":"Preset looks","data":{"look":{"accessories":[],"colors":{"outer":"#D9A441"},"garments":["top.long-sleeve-tee@1","outer.raincoat@1","bottom.jeans@1","shoe.knee-boots@1"]}},"dependencies":["top.long-sleeve-tee@1","outer.raincoat@1","bottom.jeans@1","shoe.knee-boots@1"],"families":[],"group":"Preset looks","id":"look.rainy-day","kind":"look","layering":{},"license":{"attribution":"Frame bundled content; free to use in exported videos, including commercially.","commercialUse":true,"id":"LicenseRef-Frame-Bundled","redistributable":true},"name":"Rainy day","parameters":[],"previews":{},"provenance":{"author":"Frame content pipeline (parametric authoring in tools/content)","date":"2026-10-22","method":"authored","notes":"Generated as part-contract data and validated by the rig check; awaiting human visual review (CAT-06)."},"review":{"status":"pending"},"schemaVersion":1,"synonyms":["raincoat","boots","umbrella","prop"],"tags":["preset looks"],"version":1,"viewExemptions":{},"views":[]}
