{"anchors":{},"capabilities":["rig.biped@1"],"category":"Facial overlays","data":{"colorSlot":"tear","colors":{"tear":"#8FD3FF"},"families":{"flat":{"exempt":{"back":"Face overlays are not visible from behind."},"views":{"front":{"layers":[{"shapes":[{"fill":"tear","opacityParam":"overlay.overlay.tears","path":[["M","o0"],["C","o1","o2","o3"],["C","o4","o5","o6"],["C","o7","o8","o9"],["C","o10","o11","o12"],["Z"]]},{"ellipse":{"c":"o13","rx":0.06,"ry":0.06},"fill":"#FFFFFF","opacityParam":"overlay.overlay.tears"}],"sides":["L","R"],"slot":"face.overlay","space":"eye"}],"points":{"o0":{"p":[0.6,0.498]},"o1":{"p":[0.6352,0.498]},"o10":{"p":[0.424,0.7983]},"o11":{"p":[0.6352,0.498]},"o12":{"p":[0.6,0.498]},"o13":{"p":[0.56,0.78]},"o2":{"p":[0.776,0.9017]},"o3":{"p":[0.776,0.85]},"o4":{"p":[0.776,0.9017]},"o5":{"p":[0.5648,1.015]},"o6":{"p":[0.6,1.015]},"o7":{"p":[0.5648,1.015]},"o8":{"p":[0.424,0.7983]},"o9":{"p":[0.424,0.85]}}},"side":{"layers":[{"shapes":[{"fill":"tear","opacityParam":"overlay.overlay.tears","path":[["M","o0"],["C","o1","o2","o3"],["C","o4","o5","o6"],["C","o7","o8","o9"],["C","o10","o11","o12"],["Z"]]},{"ellipse":{"c":"o13","rx":0.06,"ry":0.06},"fill":"#FFFFFF","opacityParam":"overlay.overlay.tears"}],"sides":["L","R"],"slot":"face.overlay","space":"eye"}],"points":{"o0":{"p":[0.6,0.498]},"o1":{"p":[0.6352,0.498]},"o10":{"p":[0.424,0.7983]},"o11":{"p":[0.6352,0.498]},"o12":{"p":[0.6,0.498]},"o13":{"p":[0.56,0.78]},"o2":{"p":[0.776,0.9017]},"o3":{"p":[0.776,0.85]},"o4":{"p":[0.776,0.9017]},"o5":{"p":[0.5648,1.015]},"o6":{"p":[0.6,1.015]},"o7":{"p":[0.5648,1.015]},"o8":{"p":[0.424,0.7983]},"o9":{"p":[0.424,0.85]}}},"three":{"layers":[{"shapes":[{"fill":"tear","opacityParam":"overlay.overlay.tears","path":[["M","o0"],["C","o1","o2","o3"],["C","o4","o5","o6"],["C","o7","o8","o9"],["C","o10","o11","o12"],["Z"]]},{"ellipse":{"c":"o13","rx":0.06,"ry":0.06},"fill":"#FFFFFF","opacityParam":"overlay.overlay.tears"}],"sides":["L","R"],"slot":"face.overlay","space":"eye"}],"points":{"o0":{"p":[0.6,0.498]},"o1":{"p":[0.6352,0.498]},"o10":{"p":[0.424,0.7983]},"o11":{"p":[0.6352,0.498]},"o12":{"p":[0.6,0.498]},"o13":{"p":[0.56,0.78]},"o2":{"p":[0.776,0.9017]},"o3":{"p":[0.776,0.85]},"o4":{"p":[0.776,0.9017]},"o5":{"p":[0.5648,1.015]},"o6":{"p":[0.6,1.015]},"o7":{"p":[0.5648,1.015]},"o8":{"p":[0.424,0.7983]},"o9":{"p":[0.424,0.85]}}}}},"illustrated":{"exempt":{"back":"Face overlays are not visible from behind."},"views":{"front":{"layers":[{"shapes":[{"fill":"tear","opacityParam":"overlay.overlay.tears","path":[["M","o0"],["C","o1","o2","o3"],["C","o4","o5","o6"],["C","o7","o8","o9"],["C","o10","o11","o12"],["Z"]]},{"ellipse":{"c":"o13","rx":0.06,"ry":0.06},"fill":"#FFFFFF","opacityParam":"overlay.overlay.tears"}],"sides":["L","R"],"slot":"face.overlay","space":"eye"}],"points":{"o0":{"p":[0.6,0.498]},"o1":{"p":[0.6352,0.498]},"o10":{"p":[0.424,0.7983]},"o11":{"p":[0.6352,0.498]},"o12":{"p":[0.6,0.498]},"o13":{"p":[0.56,0.78]},"o2":{"p":[0.776,0.9017]},"o3":{"p":[0.776,0.85]},"o4":{"p":[0.776,0.9017]},"o5":{"p":[0.5648,1.015]},"o6":{"p":[0.6,1.015]},"o7":{"p":[0.5648,1.015]},"o8":{"p":[0.424,0.7983]},"o9":{"p":[0.424,0.85]}}},"side":{"layers":[{"shapes":[{"fill":"tear","opacityParam":"overlay.overlay.tears","path":[["M","o0"],["C","o1","o2","o3"],["C","o4","o5","o6"],["C","o7","o8","o9"],["C","o10","o11","o12"],["Z"]]},{"ellipse":{"c":"o13","rx":0.06,"ry":0.06},"fill":"#FFFFFF","opacityParam":"overlay.overlay.tears"}],"sides":["L","R"],"slot":"face.overlay","space":"eye"}],"points":{"o0":{"p":[0.6,0.498]},"o1":{"p":[0.6352,0.498]},"o10":{"p":[0.424,0.7983]},"o11":{"p":[0.6352,0.498]},"o12":{"p":[0.6,0.498]},"o13":{"p":[0.56,0.78]},"o2":{"p":[0.776,0.9017]},"o3":{"p":[0.776,0.85]},"o4":{"p":[0.776,0.9017]},"o5":{"p":[0.5648,1.015]},"o6":{"p":[0.6,1.015]},"o7":{"p":[0.5648,1.015]},"o8":{"p":[0.424,0.7983]},"o9":{"p":[0.424,0.85]}}},"three":{"layers":[{"shapes":[{"fill":"tear","opacityParam":"overlay.overlay.tears","path":[["M","o0"],["C","o1","o2","o3"],["C","o4","o5","o6"],["C","o7","o8","o9"],["C","o10","o11","o12"],["Z"]]},{"ellipse":{"c":"o13","rx":0.06,"ry":0.06},"fill":"#FFFFFF","opacityParam":"overlay.overlay.tears"}],"sides":["L","R"],"slot":"face.overlay","space":"eye"}],"points":{"o0":{"p":[0.6,0.498]},"o1":{"p":[0.6352,0.498]},"o10":{"p":[0.424,0.7983]},"o11":{"p":[0.6352,0.498]},"o12":{"p":[0.6,0.498]},"o13":{"p":[0.56,0.78]},"o2":{"p":[0.776,0.9017]},"o3":{"p":[0.776,0.85]},"o4":{"p":[0.776,0.9017]},"o5":{"p":[0.5648,1.015]},"o6":{"p":[0.6,1.015]},"o7":{"p":[0.5648,1.015]},"o8":{"p":[0.424,0.7983]},"o9":{"p":[0.424,0.85]}}}}}},"slot":"face.overlay"},"dependencies":[],"families":["flat","illustrated"],"group":"Facial overlays","id":"overlay.tears","kind":"overlay","layering":{},"license":{"attribution":"Frame bundled content; free to use in exported videos, including commercially.","commercialUse":true,"id":"LicenseRef-Frame-Bundled","redistributable":true},"name":"Tears","parameters":[],"previews":{},"provenance":{"author":"Frame content pipeline (parametric authoring in tools/content)","date":"2026-10-22","method":"authored","notes":"Generated as part-contract data and validated by the rig check; awaiting human visual review (CAT-06)."},"review":{"status":"pending"},"schemaVersion":1,"synonyms":[],"tags":["facial overlays"],"version":1,"viewExemptions":{"back":"Face overlays are not visible from behind."},"views":["front","three","side"]}
