{"anchors":{},"capabilities":[],"category":"Scene atmosphere","data":{"atmosphere":{"matrix":[1.1,0.05,0,0,0.02,0,0.95,0.05,0,0,0.05,0,0.85,0,0.04,0,0,0,1,0],"type":"grade"}},"dependencies":[],"families":[],"group":"Colour grade","id":"atmo.retro-vhs","kind":"atmo","layering":{},"license":{"attribution":"Frame bundled content; free to use in exported videos, including commercially.","commercialUse":true,"id":"LicenseRef-Frame-Bundled","redistributable":true},"name":"Retro VHS","parameters":[{"default":1,"key":"intensity","label":"Intensity","range":[0,2],"type":"number"},{"default":"#FFFFFF","key":"color","label":"Colour","type":"color"}],"previews":{},"provenance":{"author":"Frame content pipeline (parametric authoring in tools/content)","date":"2026-10-22","method":"authored","notes":"Generated as part-contract data and validated by the rig check; awaiting human visual review (CAT-06)."},"review":{"status":"pending"},"schemaVersion":1,"synonyms":["colour","grade"],"tags":["scene atmosphere","colour grade","atmosphere"],"version":1,"viewExemptions":{},"views":[]}
